{
  "schema_version": "1.0.0",
  "data_origin": "dart",
  "rcept_no": "20250930800083",
  "corp_code": "00401731",
  "corp_name": "LG전자",
  "report_nm": "타법인주식및출자증권처분결정              ",
  "rcept_dt": "20250930",
  "normalized_text": "LG전자/타법인주식및출자증권처분결정/(2025.09.30)타법인주식및출자증권처분결정\n1. 발행회사 | 회사명 | LG ELECTRONICS INDIA LIMITED\n국적 | 인도(India) | 대표자 | 전홍주\n자본금(원) | 116,341,587,989 | 회사와 관계 | 계열회사\n발행주식총수(주) | 678,772,392 | 주요사업 | 가전 제품 생산 및 판매\n2. 처분내역 | 처분주식수(주) | 101,815,859\n처분금액(원) | -\n자기자본(원) | 25,211,664,000,000\n자기자본대비(%) | -\n대규모법인여부 | 해당\n3. 처분후 소유주식수 및 지분비율 | 소유주식수(주) | 576,956,533\n지분비율(%) | 85.0\n4. 처분목적 | 당사 인도법인의 인도시장 IPO에 따른 당사 보유 구주 매출\n5. 처분예정일자 | -\n6. 이사회결의일(결정일) | 2025-09-30\n-사외이사 참석여부 | 참석(명) | 4\n불참(명) | 0\n-감사(사외이사가 아닌 감사위원)참석여부 | -\n7. 공정거래위원회 신고대상 여부 | 미해당\n8. 풋옵션 등 계약의 체결여부 | 아니오\n-계약내용 | -\n9. 기타 투자판단과 관련한 중요사항\n1. 본 건은 당사의 자회사인 LG ELECTRONICS INDIA LIMITED의 인도 증권시장 상장에 따른 구주 매출 관련 사항입니다. 2. 상기 1항의 발행회사의 자본금(원)은 2025년 3월말 기준이며, 하나은행 최고 고시환율의 매매기준율(17.14원/루피)로 원화 환산한 금액입니다. 3. 상기 2항의 처분내역 중 처분주식수(주)는 LG ELECTRONICS INDIA LIMITED의 상장 과정에 따라 변동될 수 있으며, 그 변동이 있을 경우 재공시 예정입니다. 4. 상기 2항의 처분내역 중 처분금액(원)은 인도 증권거래위원회(SEBI)의 승인 이전까지 공모가액 범위(Price Band)를 확정할 수 없음에 따라 금액을 기재하지 않았으며, 공모가액 범위가 확정되는 즉시 재공시 예정입니다. 5. 상기 2항의 처분내역 중 자기자본(원)은 당사의 2024년도 말 연결기준 자본총계입니다. 6. 상기 3항의 처분후 지분비율은 IPO에 따른 별도 신주발행이 예정되어 있지 않으므로 공모전 발행주식총수(678,772,392주) 기준으로 산정하였습니다. 7. 상기 5항의 처분예정일자는 SEBI의 승인 이전까지 그 일자를 확정할 수 없음에 따라 일자를 기재하지 않았으며, 추후 확정되는 즉시 재공시 예정입니다. 8. 본 건 관련 세부 사항의 결정은 대표이사 또는 대표이사가 지정하는 자에게 위임하였습니다. - 하기 발행회사의 요약 재무상황은 2025년 3월말, 2024년 3월말,2023년 3월말 기준이며, 2025년 3월말 하나은행 최초 고시환율의 매매기준율(17.4원/루피)로 원화 환산한 금액입니다. - 본 공시는 2024년 12월 9일 조회공시 요구(풍문 또는 보도)에 대한 답변(미확정)에 대한 확정 공시입니다.\n※ 관련공시 | 2024-12-09 조회공시 요구(풍문 또는 보도)에 대한 답변(미확정) 2025-01-08 조회공시 요구(풍문 또는 보도)에 대한 답변(미확정) 2025-04-07 조회공시 요구(풍문 또는 보도)에 대한 답변(미확정) 2025-06-05 조회공시 요구(풍문 또는 보도)에 대한 답변(미확정)\n구분 | 자산총계 | 부채총계 | 자본총계 | 자본금 | 매출액 | 당기순이익 | 감사의견 | 외부감사인\n당해 연도 | 1,974,023,601,629 | 950,751,627,644 | 1,023,271,973,985 | 116,341,587,989 | 4,176,441,851,344 | 377,608,475,683 | 적정 | PwC\n전년도 | 1,456,637,745,334 | 810,044,549,247 | 646,593,196,086 | 19,390,264,665 | 3,659,742,336,919 | 258,988,446,481 | 적정 | PwC\n전전년도 | 1,541,296,101,101 | 794,586,498,167 | 746,709,602,934 | 19,390,264,665 | 3,405,398,231,566 | 230,523,696,288 | 적정 | PwC",
  "normalization": {
    "status": "ok",
    "original_length": 2063,
    "truncated": false,
    "selected_sections": [
      "LG전자/타법인주식및출자증권처분결정/(2025.09.30)타법인주식및출자증권처분결정"
    ]
  },
  "source": {
    "source_url": "https://dart.fss.or.kr/dsaf001/main.do?rcpNo=20250930800083",
    "document_paths": [
      "data/raw/20250930800083/20250930800083.xml"
    ]
  },
  "triggers": {
    "amount_changes": [
      {
        "metric": "처분금액",
        "status": "not_comparable",
        "triggered": null,
        "reason": "CURRENT_VALUE_MISSING",
        "current": {
          "value": null,
          "raw_value": "",
          "unit": null,
          "currency": null,
          "evidence": {
            "kind": "document",
            "rcept_no": "20250930800083",
            "document_path": "data/raw/20250930800083/20250930800083.xml",
            "section": null,
            "quote": "1. 본 건은 당사의 자회사인 LG ELECTRONICS INDIA LIMITED의 인도 증권시장 상장에 따른 구주 매출 관련 사항입니다. 2. 상기 1항의 발행회사의 자본금(원)은 2025년 3월말 기준이며, 하나은행 최고 고시환율의 매매기준율(17.14원/루피)로 원화 환산한 금액입니다. 3. 상기 2항의 처분내역 중 처분주식수(주)는 LG ELECTRONICS INDIA LIMITED의 상장 과정에 따라 변동될 수 있으며, 그 변동이 있을 경우 재공시 예정입니다. 4. 상기 2항의 처분내역 중 처분금액(원)은 인도 증권거래위원회(SEBI)의 승인 이전까지 공모가액 범위(Price Band)를 확정할 수 없음에 따라 금액을 기재하지 않았으며, 공모가액 범위가 확정되는 즉시 재공시 예정입니다. 5. 상기 2항의 처분내역 중 자기자본(원)은 당사의 2024년도 말 연결기준 자본총계입니다. 6. 상기 3항의 처분후 지분비율은 IPO에 따른 별도 신주발행이 예정되어 있지 않으므로 공모전 발행주식총수(678,772,392주) 기준으로 산정하였습니다. 7. 상기 5항의 처분예정일자는 SEBI의 승인 이전까지 그 일자를 확정할 수 없음에 따라 일자를 기재하지 않았으며, 추후 확정되는 즉시 재공시 예정입니다. 8. 본 건 관련 세부 사항의 결정은 대표이사 또는 대표이사가 지정하는 자에게 위임하였습니다. - 하기 발행회사의 요약 재무상황은 2025년 3월말, 2024년 3월말,2023년 3월말 기준이며, 2025년 3월말 하나은행 최초 고시환율의 매매기준율(17.4원/루피)로 원화 환산한 금액입니다. - 본 공시는 2024년 12월 9일 조회공시 요구(풍문 또는 보도)에 대한 답변(미확정)에 대한 확정 공시입니다.",
            "db_row": null,
            "field": null
          }
        },
        "previous": {
          "value": null,
          "raw_value": null,
          "unit": null,
          "currency": null,
          "evidence": null
        },
        "change_rate": null,
        "threshold": 0.2,
        "dimensions": null
      }
    ],
    "financial_changes": [],
    "keywords": []
  },
  "past_cases": [],
  "history_search": {
    "match_rule": "same_corp_and_normalized_report_type_unique_events",
    "search_window_years": 5,
    "cases_in_three_years": 0,
    "requested_start": "20200930",
    "end_exclusive": "20250930",
    "coverage_status": "unknown",
    "coverage_note": "검색 기간 전체의 공시 목록 수집을 확인할 수 없습니다."
  },
  "needs_verification": [
    {
      "code": "HISTORY_COVERAGE_UNKNOWN",
      "field": "history_search",
      "message": "검색 기간 전체의 공시 목록 수집을 확인할 수 없습니다."
    },
    {
      "code": "PAST_CASES_MISSING",
      "field": "past_cases",
      "message": "확인 가능한 과거 동일 유형 사례가 없습니다."
    },
    {
      "code": "AMOUNT_UNRESOLVED",
      "field": "triggers.amount_changes",
      "message": "20250930800083: 처분금액의 단위·값·표 구조가 불명확하거나 여러 번 등장합니다."
    },
    {
      "code": "FINANCIAL_DATA_MISSING",
      "field": "triggers.financial_changes",
      "message": "현재 접수번호에 직접 연결된 재무 계정이 없습니다."
    },
    {
      "code": "CURRENT_VALUE_MISSING",
      "field": "triggers.amount_changes",
      "message": "처분금액: 비교 불가 (CURRENT_VALUE_MISSING)"
    }
  ]
}